{
  "version": "1.0.0",
  "generatedAt": "2026-05-28T00:00:00.000Z",
  "source": "Partner-provided or licensed brand files",
  "licensePolicy": "Only import logos and product assets supplied by the brand owner, licensed for client demo use, or explicitly approved for BUI Pro.",
  "brands": [
    {
      "slug": "demo-bui-banner",
      "name": "BUI Banner Demo",
      "sourceUrl": "https://bui-banner-pro.vercel.app",
      "licenseStatus": "owned",
      "colors": ["#22c55e", "#6b7280", "#f8fafc"],
      "categories": ["logo", "white-label"],
      "logo": {
        "url": "data:image/svg+xml,%3Csvg xmlns='http://www.w3.org/2000/svg' viewBox='0 0 220 220'%3E%3Crect width='220' height='220' rx='28' fill='%23f8fafc'/%3E%3Ctext x='55' y='150' font-size='150' font-family='Georgia' fill='%236b7280'%3EB%3C/text%3E%3Ctext x='82' y='144' font-size='48' font-family='Arial' font-weight='900' fill='%2386efac'%3EUI%3C/text%3E%3C/svg%3E",
        "format": "svg",
        "transparent": false,
        "licenseStatus": "owned"
      }
    }
  ]
}
